id,name,description
1,Wireless Headphones,"High-quality over-ear wireless headphones with active noise cancellation and long battery life"
2,Smart Watch,"Waterproof smartwatch featuring heart rate monitoring, GPS tracking, and customizable watch faces"
3,Running Shoes,"Lightweight running shoes with breathable mesh upper and responsive cushioning for long-distance comfort"
4,DSLR Camera,"Professional-grade DSLR camera with 24.2MP sensor, 4K video recording, and interchangeable lenses"
5,Backpack,"Durable travel backpack with multiple compartments, USB charging port, and ergonomic straps"